section,subsection,level,parent_item,title,description,full_text
Rooms Names,,1,,Toy / play room (Next to kitchen),,Toy / play room (Next to kitchen)
Rooms Names,,1,,Lego Gallery room (display all mine and my fathers Lego models),,Lego Gallery room (display all mine and my fathers Lego models)
Rooms Names,,1,,Video Game room,,Video Game room
Rooms Names,,1,,Bathroom,,Bathroom
Rooms Names,,1,,Cloak room,,Cloak room
Rooms Names,,1,,Pantry,,Pantry
Rooms Names,,1,,Utility room,,Utility room
Rooms Names,,1,,Roof garden,,Roof garden
Rooms Names,,1,,Library,,Library
Rooms Names,,1,,Conservatory,,Conservatory
Rooms Names,,1,,Hall,,Hall
Rooms Names,,1,,Cinema,,Cinema
Rooms Names,,1,,Security room,,Security room
Rooms Names,,1,,Personal assistant living area,,Personal assistant living area
Rooms Names,,1,,Tardis Interior,,Tardis Interior
Rooms Names,,1,,Workshop,,Workshop
Rooms Names,,1,,Safe Room,,Safe Room
Rooms Names,,1,,Green screen room,,Green screen room
Rooms Names,,1,,Smooth white white bright room for filming,,Smooth white white bright room for filming
Rooms Names,,1,,Laundry room,,Laundry room
Rooms Names,,1,,Indoor horse riding area a,,Indoor horse riding area a
Rooms Names,,1,,Barber room,,Barber room
Stairs,,1,,Elevator,Place to put in a small elevator for when I get old and can’t walk up stairs,Elevator - Place to put in a small elevator for when I get old and can’t walk up stairs
Stairs,,1,,Hidden Dog Gate,Dog gate that can be pushed into the wall and look like there’s no gate at all.,Hidden Dog Gate - Dog gate that can be pushed into the wall and look like there’s no gate at all.
Stairs,,1,,Perfectly Sized Stairs,Stairs that are perfectly that are the right size and reduces tripping,Perfectly Sized Stairs - Stairs that are perfectly that are the right size and reduces tripping
Stairs,,1,,Carpeted Stairs are Less Slippy,Carpeted stairs so dogs don’t slip on them,Carpeted Stairs are Less Slippy - Carpeted stairs so dogs don’t slip on them
Stairs,,1,,Motion Sensor Lights,Automatic motion detector lights under the lip of the stairs (so you don’t trip down the stairs at night.,Motion Sensor Lights - Automatic motion detector lights under the lip of the stairs (so you don’t trip down the stairs at night.
Stairs,,1,,Full Size Hidden Slide,There should be a classy fashionable good looking indoor slide hidden from the main staircase,Full Size Hidden Slide - There should be a classy fashionable good looking indoor slide hidden from the main staircase
Stairs,,1,,Staircase Safety Gates,"Stylish, retractable gates at the top and bottom of staircases to prevent unsupervised climbing or falls.","Staircase Safety Gates - Stylish, retractable gates at the top and bottom of staircases to prevent unsupervised climbing or falls."
Kitchen,,1,,Medicine Box Easy to Get To,For when you cut yourself cooking or burn yourself while cooking.,Medicine Box Easy to Get To - For when you cut yourself cooking or burn yourself while cooking.
Kitchen,,1,,Place To Hang Up Washing Gloves,Washing Gloves Hooo,Place To Hang Up Washing Gloves - Washing Gloves Hooo
Kitchen,,1,,Two dish washes,One for dirty dishes and one you take clean dishes out. Then you never have to do any washing you just load and unload dishes as you need to.,Two dish washes - One for dirty dishes and one you take clean dishes out. Then you never have to do any washing you just load and unload dishes as you need to.
Kitchen,,1,,Lots of draws not cud boards,Draws allow you to see things at the back easily where as cupboards often leave things untouched at the back.,Lots of draws not cud boards - Draws allow you to see things at the back easily where as cupboards often leave things untouched at the back.
Kitchen,,1,,Don’t put sink on kitchen island,Put the sink and tap along the wall so it’s not obstructing the open space,Don’t put sink on kitchen island - Put the sink and tap along the wall so it’s not obstructing the open space
Kitchen,,1,,Don’t use tiles as splash backs,The tiles get grubbing and dirty in the grout goes bad colour over time.,Don’t use tiles as splash backs - The tiles get grubbing and dirty in the grout goes bad colour over time.
Kitchen,,1,,Hidden Walk In Pantry,The door of the pantry just looks like a normal kitchen cupboard but actually goes way deeper to reveal a hidden walk in kitchen pantry,Hidden Walk In Pantry - The door of the pantry just looks like a normal kitchen cupboard but actually goes way deeper to reveal a hidden walk in kitchen pantry
Kitchen,,1,,Kitchen Opens to Living Room,Most people will like if the kitchen opens to the dining or living rooms so whoever is cooking can still interact with guests or keep an eye on the kids playing.,Kitchen Opens to Living Room - Most people will like if the kitchen opens to the dining or living rooms so whoever is cooking can still interact with guests or keep an eye on the kids playing.
Kitchen,,1,,Joint Hot and Cold Tap in Sink,So you can get the right temperature for washing the dishes.,Joint Hot and Cold Tap in Sink - So you can get the right temperature for washing the dishes.
Kitchen,,1,,Non Plastic or Wood Chopping Board,"I don’t think it’s good having tiny microplastic in my food. Could be Carcinogenic. A wood one has lots of micropores where the food seaps in and makes it hard to wash. that So a stone, metal or glass one is probably better.","Non Plastic or Wood Chopping Board - I don’t think it’s good having tiny microplastic in my food. Could be Carcinogenic. A wood one has lots of micropores where the food seaps in and makes it hard to wash. that So a stone, metal or glass one is probably better."
Kitchen,,1,,Food Bin the Automatically Opens,Always so annoying when you have to touch the dirty food bin when peeling an orange or banana.,Food Bin the Automatically Opens - Always so annoying when you have to touch the dirty food bin when peeling an orange or banana.
Kitchen,,1,,Best Dishwasher Money Can Buy,Washing dishes by hand takes a lot of your time each day.,Best Dishwasher Money Can Buy - Washing dishes by hand takes a lot of your time each day.
Kitchen,,1,,Double massive sinks,One sink for washing and cleaning food for cooking and then another big sink to soak lots of dishes and cutlery before putting them in the dishwasher so that the food does dry and get stuck on them.,Double massive sinks - One sink for washing and cleaning food for cooking and then another big sink to soak lots of dishes and cutlery before putting them in the dishwasher so that the food does dry and get stuck on them.
Kitchen,,1,,Extra Movable Traveling Island,a hidden away kitchen table top surface that can be easily slidden out when you need more kitchen surface space. And put away when you want more openness to the kitchen,Extra Movable Traveling Island - a hidden away kitchen table top surface that can be easily slidden out when you need more kitchen surface space. And put away when you want more openness to the kitchen
Kitchen,,1,,Double Chopping board slot,to stop chopping board sliding around have a mechanism that keeps them from sliding around when cutting stuff. Two slots for when you need to cut lots of stuff or two people need to cut stuff.,Double Chopping board slot - to stop chopping board sliding around have a mechanism that keeps them from sliding around when cutting stuff. Two slots for when you need to cut lots of stuff or two people need to cut stuff.
Kitchen,,1,,Two Microwaves,"Always having to wait to hit up food take it in turns, and by the time the second persons is done the first ones has got cold.","Two Microwaves - Always having to wait to hit up food take it in turns, and by the time the second persons is done the first ones has got cold."
Kitchen,,1,,Under Cupboards kitchen Lights to light up kitchen surfaces,Even with main lights the cupboard often cast shadow on the back of the kitchen surfaces so we should have lights at the back to light that up,Under Cupboards kitchen Lights to light up kitchen surfaces - Even with main lights the cupboard often cast shadow on the back of the kitchen surfaces so we should have lights at the back to light that up
Kitchen,,1,,Collapsible Shelves attached to bottom of top cupboards,These shelves are attached to the bottom of the cupboards and have a mechanising for exiting downwards giving you more space to put things.,Collapsible Shelves attached to bottom of top cupboards - These shelves are attached to the bottom of the cupboards and have a mechanising for exiting downwards giving you more space to put things.
Kitchen,,1,,Space Under Sink for Legs,Sometimes you’ll need to sit/stand at the sink for a while washing up or cutting vegetables and it would be nice if you could sit down and tuck your legs under the sink so you can actually get closer to the sink when using it.,Space Under Sink for Legs - Sometimes you’ll need to sit/stand at the sink for a while washing up or cutting vegetables and it would be nice if you could sit down and tuck your legs under the sink so you can actually get closer to the sink when using it.
Kitchen,,1,,Microwave with Completely Transparent Window,This is a new technology that uses Electro Magnetic Interfaces film which invisible to the naked eye,Microwave with Completely Transparent Window - This is a new technology that uses Electro Magnetic Interfaces film which invisible to the naked eye
Kitchen,,1,,Not Too Low Table Tops,Table tops in kitchen and in bathroom not to low down that I have to bend my back to use them for hours. (But not to high that shorter people can’t use them),Not Too Low Table Tops - Table tops in kitchen and in bathroom not to low down that I have to bend my back to use them for hours. (But not to high that shorter people can’t use them)
Kitchen,,1,,Blackout Curtains,For watching movies,Blackout Curtains - For watching movies
Kitchen,,1,,Big Sink,sometimes you have really big pans that are hard to wash so a big sink basin would be really helpful.,Big Sink - sometimes you have really big pans that are hard to wash so a big sink basin would be really helpful.
Kitchen,,1,,Tall Taps,"Tall high taps above sink to help fit pots and pans in the sink, or bendable taps","Tall Taps - Tall high taps above sink to help fit pots and pans in the sink, or bendable taps"
Kitchen,,1,,Magnetic Childproof Locks,"– Hidden magnetic locks on cupboards and drawers to keep dangerous tools, sharp objects, and chemicals safely away from children.","Magnetic Childproof Locks - – Hidden magnetic locks on cupboards and drawers to keep dangerous tools, sharp objects, and chemicals safely away from children."
Kitchen,,1,,Lots of Table Surface Space,"Lots of counter top space Kitchen but don’t put that sink, stove and fridge too far away","Lots of Table Surface Space - Lots of counter top space Kitchen but don’t put that sink, stove and fridge too far away"
Kitchen,,1,,Two Big Sinks Next To Each Other,Two big sinks next to each other in kitchen. One for dishwashing one for other uses.,Two Big Sinks Next To Each Other - Two big sinks next to each other in kitchen. One for dishwashing one for other uses.
Kitchen,,1,,Big Dishwashing Drying Wrack,Extra large double drying rack for drying dishes,Big Dishwashing Drying Wrack - Extra large double drying rack for drying dishes
Kitchen,,1,,Pot Filler Over Stove,"Pot filler over stove for filling pots with water on the stove without having to to sink or kettle, also must have a short hose to fill pots at different heights","Pot Filler Over Stove - Pot filler over stove for filling pots with water on the stove without having to to sink or kettle, also must have a short hose to fill pots at different heights"
Kitchen,,1,,Hidden Knife Cupboard,Vertical knife cupboard so knives can be hidden away safely away from children,Hidden Knife Cupboard - Vertical knife cupboard so knives can be hidden away safely away from children
Kitchen,,1,,Built-In Pet Spaces,"Hidden pet feeding stations, built-in beds, and washing stations for pets integrated into the kitchen","Built-In Pet Spaces - Hidden pet feeding stations, built-in beds, and washing stations for pets integrated into the kitchen"
Kitchen,,1,,Hidden Washing Machine and Dishwasher,Cardboard doors in front of washing machine and dishwasher so you can hid them away,Hidden Washing Machine and Dishwasher - Cardboard doors in front of washing machine and dishwasher so you can hid them away
Kitchen,,1,,Plastic instead of wood chopping board and spoons,Cooking with wooden items can be bad as the bacteria can easily get trapped in absorbed into the wood.,Plastic instead of wood chopping board and spoons - Cooking with wooden items can be bad as the bacteria can easily get trapped in absorbed into the wood.
Kitchen,,1,,Automatic Opening Hidden Bins,Bin drawers so you can hide the bin. Also the bin should have a motion sensored,Automatic Opening Hidden Bins - Bin drawers so you can hide the bin. Also the bin should have a motion sensored
Kitchen,,1,,Back Splash Tiles,Don’t forget a backsplash or tiles in your kitchen to keep your kitchen walls clean.,Back Splash Tiles - Don’t forget a backsplash or tiles in your kitchen to keep your kitchen walls clean.
Kitchen,,1,,Proper Hot Tap,Proper hot tap in the kitchen as it’s easier to dry dishes when the water evaporates after you’ve dried them. (But might have bacteria in it),Proper Hot Tap - Proper hot tap in the kitchen as it’s easier to dry dishes when the water evaporates after you’ve dried them. (But might have bacteria in it)
Kitchen,,1,,Hidden Tool Box in Cupboard,There should be a place to hide and put away a tool box in the kitchen that is easy to get to.,Hidden Tool Box in Cupboard - There should be a place to hide and put away a tool box in the kitchen that is easy to get to.
Kitchen,,1,,Second Extra Large Recycling Bin,There should be a big recycling bin in the kitchen or near the entrance for all the cardboard boxes and packaging to get from deliveries and from Amazon. They should be an extra bin in the kitchen for large bottles and cartons for the recycling so they don’t full up all the big stuff.,Second Extra Large Recycling Bin - There should be a big recycling bin in the kitchen or near the entrance for all the cardboard boxes and packaging to get from deliveries and from Amazon. They should be an extra bin in the kitchen for large bottles and cartons for the recycling so they don’t full up all the big stuff.
Kitchen,,1,,Motion Sensor Lights in Cupboards,for big cupboards and pantry and under the stairs cupboard all connected to the mains not battery operated.,Motion Sensor Lights in Cupboards - for big cupboards and pantry and under the stairs cupboard all connected to the mains not battery operated.
Kitchen,,1,,Fire Extinguisher and Blanket,Fire extinguisher and Blanket and possible a hose in the kitchen,Fire Extinguisher and Blanket - Fire extinguisher and Blanket and possible a hose in the kitchen
Kitchen,,1,,Charging Port In Cupboard Above Sink,A charging port in the cupboard above the sink so I can put my iPad there while doing the washing up.,Charging Port In Cupboard Above Sink - A charging port in the cupboard above the sink so I can put my iPad there while doing the washing up.
Kitchen,,1,,Massive Projector and Scree,n - in the kitchen that can be hidden away for watching cooking tutorials,Massive Projector and Scree - n - in the kitchen that can be hidden away for watching cooking tutorials
Kitchen,,1,,Corner Draws in kitchen,To make it easier to put stuff in corner of counter cupboard space.,Corner Draws in kitchen - To make it easier to put stuff in corner of counter cupboard space.
Kitchen,,1,,Swivel trays for Corner Cupboards,makes it easier to get to things into cupboards,Swivel trays for Corner Cupboards - makes it easier to get to things into cupboards
Kitchen,,1,,Large hidden bins,There’s nothing more annoying then constantly having to take out the recycling bin bins,Large hidden bins - There’s nothing more annoying then constantly having to take out the recycling bin bins
Kitchen,,1,,Blue Theme,Have a blue plates and dishes and blue kitchen theme to make you want to eat less,Blue Theme - Have a blue plates and dishes and blue kitchen theme to make you want to eat less
Kitchen,,1,,Extra long Teaspoons,for getting to the bottom of tall thin jars,Extra long Teaspoons - for getting to the bottom of tall thin jars
Kitchen,,1,,Actual Stainless Steal,Make sure you get actual stainless steel not grimy stainless steel,Actual Stainless Steal - Make sure you get actual stainless steel not grimy stainless steel
Kitchen,,1,,Different Colour Sponges for Purposes,Different colour sponge for washing dishes and cleaning surfaces.,Different Colour Sponges for Purposes - Different colour sponge for washing dishes and cleaning surfaces.
Kitchen,,1,,LED Faucet,(no batteries needed),LED Faucet - (no batteries needed)
Kitchen,,1,,Oven Gloves with Silicone Mittens,Fabric oven gloves are harder to clean when you spill sources or liquids on them.,Oven Gloves with Silicone Mittens - Fabric oven gloves are harder to clean when you spill sources or liquids on them.
Kitchen,,1,,Non White Table Surface,A white table surface will show Staines and dirt a lot easier. Unless it’s a made from a stone that doesn’t stain easily.,Non White Table Surface - A white table surface will show Staines and dirt a lot easier. Unless it’s a made from a stone that doesn’t stain easily.
Kitchen,,1,,Plastic Food Bag Clips,Lots of clips for clipping food bags and putting them in cupboards and the fridge,Plastic Food Bag Clips - Lots of clips for clipping food bags and putting them in cupboards and the fridge
Kitchen,,1,,Mini Pizza Oven,You’re very own mini pizza oven,Mini Pizza Oven - You’re very own mini pizza oven
Dinning Room,,1,,Blackout Curtains,For watching movies,Blackout Curtains - For watching movies
Dinning Room,,1,,Overlapping Curtains,Curtain rails that overlap so there’s no light that seep through,Overlapping Curtains - Curtain rails that overlap so there’s no light that seep through
Dinning Room,,1,,Non White Table Surface,A white table surface will show Staines and dirt a lot easier,Non White Table Surface - A white table surface will show Staines and dirt a lot easier
Dinning Room,,1,,Machine Washable Rugs,There’s no doubt that people will drop food and drinks on the rug. Machine washable means we can keep them clean when guest come around.,Machine Washable Rugs - There’s no doubt that people will drop food and drinks on the rug. Machine washable means we can keep them clean when guest come around.
Bedroom,,1,,Silent Air Conditioning,There’s nothing more annoying than a loud air conditioner when you’re trying to sleep. My must stressful moment on holiday where when it was too hot to turn off the air conditioner but also way too loud while I try to fall asleep.,Silent Air Conditioning - There’s nothing more annoying than a loud air conditioner when you’re trying to sleep. My must stressful moment on holiday where when it was too hot to turn off the air conditioner but also way too loud while I try to fall asleep.
Bedroom,,1,,Alaskan King Bed,This is a great bed size for the whole family,Alaskan King Bed - This is a great bed size for the whole family
Bedroom,,1,,Complete Silence at Night,"No noise from air conditioning system, or any hvac system or anything. No nose form outside, trains, planes, cars or any other loud nosiness outside. No white noise. Just complete silence at night.","Complete Silence at Night - No noise from air conditioning system, or any hvac system or anything. No nose form outside, trains, planes, cars or any other loud nosiness outside. No white noise. Just complete silence at night."
Bedroom,,1,,Zippable pillow cases and duvet covers,Button duvet covers always come undone. And pillow cases without zip always let the pillow slip out. So instead get pillow cases and duvet covers with zips on. But good quality zips that won’t break easily.,Zippable pillow cases and duvet covers - Button duvet covers always come undone. And pillow cases without zip always let the pillow slip out. So instead get pillow cases and duvet covers with zips on. But good quality zips that won’t break easily.
Bedroom,,1,,Super Soft Duvet Cover,Non stiff or rough duvet cover,Super Soft Duvet Cover - Non stiff or rough duvet cover
Bedroom,,1,,Dual Big Floor to Ceiling Mirrors,Two big mirrors for two people so you can easily see the outfit you’re coming out for the day.,Dual Big Floor to Ceiling Mirrors - Two big mirrors for two people so you can easily see the outfit you’re coming out for the day.
Bedroom,,1,,Two Sinks in Master Bedroom En-suite,Two sinks for when you and your partner are trying to get ready at the same time.,Two Sinks in Master Bedroom En-suite - Two sinks for when you and your partner are trying to get ready at the same time.
Bedroom,,1,,Secret Door Entrance Looks Like Wardrobe,Just like in Narnia the actually walk in wardrobe could be hind a normal looking wardrobe.,Secret Door Entrance Looks Like Wardrobe - Just like in Narnia the actually walk in wardrobe could be hind a normal looking wardrobe.
Bedroom,,1,,True Mirror,"Each bedroom has a true mirror, two mirrors at 90° without a seam between them. Shows how people really see you.","True Mirror - Each bedroom has a true mirror, two mirrors at 90° without a seam between them. Shows how people really see you."
Bedroom,,1,,Large concealed hidden bin,You’ll be surprised at how many times you need the bin in the bedroom but it shouldn’t be visible and should be quite big so you don’t habe to keep changing it.,Large concealed hidden bin - You’ll be surprised at how many times you need the bin in the bedroom but it shouldn’t be visible and should be quite big so you don’t habe to keep changing it.
Bedroom,,1,,Easily Accessible Extra Duvet - Never know when your heating will brake or you just want to be extra cosy. Always nice to have a spare big duvet in an easily accessible cupboard.,,Easily Accessible Extra Duvet - Never know when your heating will brake or you just want to be extra cosy. Always nice to have a spare big duvet in an easily accessible cupboard.
Bedroom,,1,,Light Switch for Outdoor Lights,sometimes you hear a sound at night and want to check outside so you could have a switch to turn on all the lights outside your window and the floodlights in your garden. All from the comfort of your bedroom.,Light Switch for Outdoor Lights - sometimes you hear a sound at night and want to check outside so you could have a switch to turn on all the lights outside your window and the floodlights in your garden. All from the comfort of your bedroom.
Bedroom,,1,,Laundry room in noise cancelled bedroom closet,What’s the point in taking your laundry all the way downstairs if you’re just going to have to take them back up to your bedroom when done. Just do your laundry next to your bedroom in your walk in closet.,Laundry room in noise cancelled bedroom closet - What’s the point in taking your laundry all the way downstairs if you’re just going to have to take them back up to your bedroom when done. Just do your laundry next to your bedroom in your walk in closet.
Bedroom,,1,,Motion Activated Closet Lights,To save you accidentally forgetting to turn off your closet like get in wired powered motion activated closet lights.,Motion Activated Closet Lights - To save you accidentally forgetting to turn off your closet like get in wired powered motion activated closet lights.
Bedroom,,1,,TV slides behind because or wall,Instead of a big black tv or a picture frame tv being centre of attention we move it behind a an easy to slide bookcase or wall.,TV slides behind because or wall - Instead of a big black tv or a picture frame tv being centre of attention we move it behind a an easy to slide bookcase or wall.
Bedroom,,1,,Hidden heated clothes racks,"it’s so nice having hot warm clothes in the morning, but you don’t always want them to be seen, so having a heated cupboard and way to hang up clothes that you can take out freshly warm in the morning would be really nice.","Hidden heated clothes racks - it’s so nice having hot warm clothes in the morning, but you don’t always want them to be seen, so having a heated cupboard and way to hang up clothes that you can take out freshly warm in the morning would be really nice."
Bedroom,,1,,Foldable Wall Parting for Loft Bedroom,"In the main bedroom over the loft layout, it’s open to big windows, so their needs to be a rollable wall parting to close off that space for when we want privacy in the bed. But at the same time we don’t want a random floating bar obstructing our view unless it was really high up. So maybe just a really high curtain, where the rail didn’t obstruct our view.","Foldable Wall Parting for Loft Bedroom - In the main bedroom over the loft layout, it’s open to big windows, so their needs to be a rollable wall parting to close off that space for when we want privacy in the bed. But at the same time we don’t want a random floating bar obstructing our view unless it was really high up. So maybe just a really high curtain, where the rail didn’t obstruct our view."
Bedroom,,1,,Two Warm and Cold taps in en-suite bathroom,for when you went to wash your hands together,Two Warm and Cold taps in en-suite bathroom - for when you went to wash your hands together
Bedroom,,1,,Lots of sockets on either side of each bed,it’s always annoying when there’s not enough sockets to charge your device at night. Could also hide the wires inside a drawer,Lots of sockets on either side of each bed - it’s always annoying when there’s not enough sockets to charge your device at night. Could also hide the wires inside a drawer
